Requirement ID,Source Doc,Source Section,Module,Requirement Statement,User Role(s),Priority,Complexity,Dependency/Related IDs,Acceptance Criteria Needed,Status,MVP Scope,Test Required,Owner Agent,Notes
PART-004,12,Approval required,Partners,Partner-created projects must be approved by Diginoces/admin before couple access.,"Diginoces admin, Partner",Must-have,High,PART-003,Yes,Not started,MVP,Yes,Backend Agent,
PART-005,12,Partner restrictions,Partners,"Partners cannot manage pricing, see revenue, approve payment exceptions, or view internal notes/audit logs.",Partner,Must-have,High,ROLE-004;PAY-015,Yes,Not started,MVP,Yes,Security Agent,
PART-006,12,Partner communication,Partners,Partners can communicate with couple through project comment thread; Diginoces/admin can see it.,"Partner, Couple, Diginoces admin",Should-have,Medium,,Yes,Not started,MVP,Yes,Frontend Agent,
PART-007,12,No commissions,Partners,Version 1 tracks projects brought by partners but does not manage commissions/referral fees.,Diginoces admin,Must-have,Low,,Yes,Not started,MVP,Yes,Backend Agent,
REP-001,13,Dashboards,Reports & Dashboards,"System must provide global, project, event, couple, partner, check-in, and operations dashboards with role-based visibility.",All,Must-have,High,,Yes,Not started,MVP,Yes,Frontend Agent,
REP-002,13,Global dashboard,Reports & Dashboards,Global business dashboard visible only to Diginoces/admin and authorized internal roles.,Diginoces admin,Must-have,Medium,ROLE-002,Yes,Not started,MVP,Yes,Security Agent,
REP-003,13,Couple dashboard,Reports & Dashboards,Couple dashboard shows simplified progress without internal notes/audit/revenue.,"Bride, Groom",Must-have,Medium,ROLE-005,Yes,Not started,MVP,Yes,Frontend Agent,
REP-004,13,Partner dashboard,Reports & Dashboards,Partner dashboard shows assigned/originated projects without revenue/payment details.,Partner,Should-have,Medium,PART-005,Yes,Not started,MVP,Yes,Frontend Agent,
REP-005,13,Report exports,Reports & Dashboards,"Reports must export as PDF, Excel, or CSV depending on use case and permissions.","Diginoces admin, Couple",Must-have,Medium,,Yes,Not started,MVP,Yes,Data Agent,
REP-006,13,Audit logs,Audit Logs,"System must keep internal, read-only audit logs for sensitive actions.",Diginoces admin,Must-have,High,,Yes,Not started,MVP,Yes,Backend Agent,
REP-007,13,Audit visibility,Audit Logs,Audit logs visible only to Diginoces/admin and authorized internal roles.,Diginoces admin,Must-have,High,REP-006,Yes,Not started,MVP,Yes,Security Agent,
FILE-001,14,App-owned storage,Files & Storage,Future platform must use own internal file storage as official storage system.,Diginoces admin,Must-have,High,PV-006,Yes,Not started,MVP,Yes,Architecture Agent,
FILE-002,14,Project library,Files & Storage,Each wedding project must have a file library with categories.,Diginoces staff,Must-have,Medium,,Yes,Not started,MVP,Yes,Frontend Agent,
FILE-003,14,Event files,Files & Storage,"System must support event-level files such as templates, reports, table CSVs, and check-in reports.",Diginoces staff,Should-have,Medium,PROJ-002,Yes,Not started,MVP,Yes,Backend Agent,
FILE-004,14,Guest files,Files & Storage,"System must support guest-specific files linked to guest, event, invitation ID, version, and active status.","Guest, Staff",Must-have,High,INV-015,Yes,Not started,MVP,Yes,Files Agent,
FILE-005,14,Version history,Files & Storage,Key files must support version history with active/latest marker.,Diginoces staff,Must-have,Medium,INV-015,Yes,Not started,MVP,Yes,Files Agent,
FILE-006,14,Secure downloads,Files & Storage,"Guest-facing file downloads must use secure, revocable links and expose only own files.",Guest,Must-have,High,RSVP-013,Yes,Not started,MVP,Yes,Security Agent,
FILE-007,14,Retention,Files & Storage,Project files retained for one year after wedding before deletion/archive action.,Diginoces admin,Should-have,Medium,,Yes,Not started,MVP,Yes,Backend Agent,
FILE-008,14,Canva exports,Files & Storage,System must store Canva CSV exports with metadata and versioning.,Diginoces staff,Should-have,Medium,WISH-007;SEAT-011,Yes,Not started,MVP,Yes,Files Agent,
FILE-009,14,Upload validation,Files & Storage,"File uploads must validate type, size, corruption, and dangerous formats.",All,Must-have,High,,Yes,Not started,MVP,Yes,Security Agent,
AI-001,15,AI assistance,AI Assistance,"AI assistance must suggest, draft, clean, summarize, and warn without bypassing user permissions.",All,Should-have,High,,Yes,Not started,Post-MVP,Yes,AI Agent,
AI-002,15,AI access,AI Assistance,"AI available to admin, staff, partners, bride, groom with permission-aware behavior.",All,Should-have,Medium,ROLE-001,Yes,Not started,Post-MVP,Yes,AI Agent,
AI-003,15,Before/after lock,AI Assistance,Bride/groom can apply AI suggestions directly only while list is unlocked; after lock suggestions become requests.,"Bride, Groom",Should-have,Medium,GM-013,Yes,Not started,Post-MVP,Yes,AI Agent,
AI-004,15,AI cleanup,AI Assistance,"AI should support guest name cleanup, duplicate detection, phone formatting, import assistance, tags, seating suggestions.",All,Should-have,High,GM-008,Yes,Not started,Post-MVP,Yes,AI Agent,
AI-005,15,AI message drafting,AI Assistance,AI can draft WhatsApp messages and translations but approved templates control sending.,Diginoces admin,Could-have,Medium,MSG-002,Yes,Not started,Post-MVP,Yes,AI Agent,
AI-006,15,AI audit,AI Assistance,AI-accepted data changes must be logged with human user as actor.,All,Should-have,Medium,REP-006,Yes,Not started,Post-MVP,Yes,Backend Agent,
TECH-001,16,Responsive web app,Technical Architecture,"Version 1 must be a responsive web app optimized for phones, tablets, laptops.",All,Must-have,High,,Yes,Not started,MVP,Yes,Frontend Agent,
TECH-002,16,Recommended stack,Technical Architecture,Recommended stack: React/Next.js + TypeScript frontend PostgreSQL database modular backend.,Developers,Should-have,High,,Yes,Not started,MVP,Yes,Architecture Agent,
TECH-003,16,PostgreSQL,Technical Architecture,A relational PostgreSQL database is recommended for structured project/event/guest data.,Developers,Must-have,High,,Yes,Not started,MVP,Yes,Architecture Agent,
TECH-004,16,Backend permissions,Technical Architecture,"Backend must enforce role-based permissions, not only frontend restrictions.",Developers,Must-have,High,ROLE-001,Yes,Not started,MVP,Yes,Security Agent,
TECH-005,16,Background jobs,Technical Architecture,Heavy/scheduled tasks must use background jobs/queues.,Developers,Must-have,High,,Yes,Not started,MVP,Yes,Architecture Agent,
TECH-006,16,PDF worker,Technical Architecture,PDF generation should run in background worker or dedicated service.,Developers,Must-have,High,INV-011,Yes,Not started,MVP,Yes,PDF/QR Agent,
TECH-007,16,Offline check-in PWA,Technical Architecture,Offline check-in should use PWA + IndexedDB/preload/sync design.,Developers,Must-have,High,CHK-011,Yes,Not started,MVP,Yes,Check-in Agent,
TECH-008,16,Google Calendar,Integrations,App should integrate with Google Calendar while internal scheduling remains source of truth.,"Staff, Partners, Couple",Should-have,Medium,,Yes,Not started,Post-MVP,Yes,Architecture Agent,
TECH-009,16,Canva roadmap,Integrations,Version 1 uses Canva CSV export; direct Canva integration can be explored later.,Diginoces staff,Should-have,Medium,PV-005,Yes,Not started,Post-MVP,Yes,Architecture Agent,
TECH-010,16,Token security,Technical Architecture,"Public guest tokens and check-in tokens must be secure, separate, and revocable.","Guest, Staff",Must-have,High,RSVP-001;CHK-003,Yes,Not started,MVP,Yes,Security Agent,
ROAD-001,17,Phased roadmap,Roadmap,Project must be built progressively by phases rather than all at once.,"Diginoces admin, Agents",Must-have,Medium,,Yes,Not started,MVP,Yes,Orchestrator Agent,
ROAD-002,17,MVP scope,Roadmap,MVP must include core end-to-end wedding operation features before advanced AI/integrations.,"Diginoces admin, Agents",Must-have,High,,Yes,Not started,MVP,Yes,Orchestrator Agent,
ROAD-003,17,Delayed features,Roadmap,"Native mobile app, direct Canva integration, full WhatsApp API automation, commissions, multi-currency, white-label SaaS are post-MVP.",Diginoces admin,Must-have,Medium,,Yes,Not started,Post-MVP,No,Orchestrator Agent,